{
  "schema_version": 1,
  "generated_at": "2026-10-24T10:15:56Z",
  "generator_commit": "f3fa2db198e8a71ccb05bdd7f58358674f1afc5d",
  "tracks": [
    {
      "id": "data",
      "label": "Data",
      "description": "Datasets and coverage the data team is building, has shipped, or is still weighing.",
      "file": "roadmap/data.json"
    },
    {
      "id": "platform",
      "label": "Platform",
      "file": "roadmap/platform.json"
    },
    {
      "id": "ai-tools",
      "label": "AI tools",
      "file": "roadmap/ai-tools.json"
    }
  ]
}
